{
  "slug": "mammoth75",
  "name": "Mammoth75",
  "vendorSlug": "wuque-studio",
  "layout": "75",
  "caseMaterial": "aluminum",
  "mountStyle": "gasket",
  "hotswap": true,
  "wireless": true,
  "releasedAt": "2023-05-01",
  "status": "group-buy",
  "description": "Wuque Studio's 75% with exploded arrows, a large magnetic knob, and aluminum or brass bottoms with mirror PVD or sandblasted finishes. Gasket mount with PORON dampening; ~2.0 kg unbuilt.",
  "updatedAt": "2026-05-09T20:00:00.000Z"
}
