{
  "slug": "mode-sonnet",
  "name": "Mode Sonnet",
  "vendorSlug": "cannonkeys",
  "layout": "65",
  "caseMaterial": "aluminum",
  "mountStyle": "gasket",
  "hotswap": true,
  "wireless": false,
  "releasedAt": "2024-09-01",
  "status": "in-stock",
  "description": "65 percent gasket-mounted aluminum board from Mode Designs with hotswap PCBs and a soft, balanced typing feel. Mid-priced for the segment; ships with a brass weight option.",
  "updatedAt": "2026-05-08T00:00:00.000Z"
}
